[
  {
    "product_id": "pub_ip15pm",
    "product_name": "Apple iPhone 15 Pro Max 256GB VN/A",
    "brand": "Apple",
    "category": "Smartphone",
    "subcategory": "Flagship",
    "price": 29490000.0,
    "currency": "VND",
    "rating": 4.9,
    "review_count": 420,
    "seller": "Tiki Trading",
    "product_url": "https://tiki.vn/p/ip15pm",
    "image_url": "https://tiki.vn/img/ip15pm.jpg",
    "source": "public_ecommerce_dataset",
    "created_at": "2026-08-01T08:00:00Z",
    "updated_at": "2026-09-24T08:00:00Z"
  },
  {
    "product_id": "pub_s24u",
    "product_name": "Samsung Galaxy S24 Ultra 5G 256GB",
    "brand": "Samsung",
    "category": "Smartphone",
    "subcategory": "Flagship",
    "price": 27990000.0,
    "currency": "VND",
    "rating": 4.8,
    "review_count": 310,
    "seller": "Samsung Flagship",
    "product_url": "https://tiki.vn/p/s24u",
    "image_url": "https://tiki.vn/img/s24u.jpg",
    "source": "public_ecommerce_dataset",
    "created_at": "2026-08-01T08:00:00Z",
    "updated_at": "2026-09-24T08:00:00Z"
  },
  {
    "product_id": "pub_mba_m3",
    "product_name": "MacBook Air M3 13 inch 2024 256GB",
    "brand": "Apple",
    "category": "Laptop",
    "subcategory": "Ultrabook",
    "price": 26890000.0,
    "currency": "VND",
    "rating": 4.9,
    "review_count": 195,
    "seller": "Apple Flagship Store",
    "product_url": "https://tiki.vn/p/mbam3",
    "image_url": "https://tiki.vn/img/mbam3.jpg",
    "source": "public_ecommerce_dataset",
    "created_at": "2026-08-01T08:00:00Z",
    "updated_at": "2026-09-24T08:00:00Z"
  },
  {
    "product_id": "pub_wh1000xm5",
    "product_name": "Sony WH-1000XM5 Wireless Noise Cancelling",
    "brand": "Sony",
    "category": "Accessories",
    "subcategory": "Audio",
    "price": 7490000.0,
    "currency": "VND",
    "rating": 4.8,
    "review_count": 280,
    "seller": "Sony Center",
    "product_url": "https://tiki.vn/p/xm5",
    "image_url": "https://tiki.vn/img/xm5.jpg",
    "source": "public_ecommerce_dataset",
    "created_at": "2026-08-01T08:00:00Z",
    "updated_at": "2026-09-24T08:00:00Z"
  }
]