[
  {
    "product_id": "iphone_15_pro",
    "product_name": "iPhone 15 Pro 128GB",
    "brand": "Apple",
    "category": "Smartphone",
    "subcategory": "Premium Tech",
    "price": 27990000.0,
    "currency": "VND",
    "rating": 4.5,
    "review_count": 2875,
    "seller": "Apple Official Store",
    "product_url": "https://shop.sentinel.ai/p/iphone_15_pro",
    "image_url": "https://assets.sentinel.ai/images/iphone_15_pro.jpg",
    "source": "catalog_sync",
    "created_at": "2026-07-26T08:00:00Z",
    "updated_at": "2026-09-24T08:00:00Z"
  },
  {
    "product_id": "iphone_15",
    "product_name": "iPhone 15 128GB",
    "brand": "Apple",
    "category": "Smartphone",
    "subcategory": "Premium Tech",
    "price": 19490000.0,
    "currency": "VND",
    "rating": 4.7,
    "review_count": 4079,
    "seller": "Apple Official Store",
    "product_url": "https://shop.sentinel.ai/p/iphone_15",
    "image_url": "https://assets.sentinel.ai/images/iphone_15.jpg",
    "source": "catalog_sync",
    "created_at": "2026-07-26T08:00:00Z",
    "updated_at": "2026-09-24T08:00:00Z"
  },
  {
    "product_id": "galaxy_s24_ultra",
    "product_name": "Samsung Galaxy S24 Ultra 256GB",
    "brand": "Samsung",
    "category": "Smartphone",
    "subcategory": "Premium Tech",
    "price": 29990000.0,
    "currency": "VND",
    "rating": 4.6,
    "review_count": 3008,
    "seller": "Samsung Official Store",
    "product_url": "https://shop.sentinel.ai/p/galaxy_s24_ultra",
    "image_url": "https://assets.sentinel.ai/images/galaxy_s24_ultra.jpg",
    "source": "catalog_sync",
    "created_at": "2026-07-26T08:00:00Z",
    "updated_at": "2026-09-24T08:00:00Z"
  },
  {
    "product_id": "galaxy_s24",
    "product_name": "Samsung Galaxy S24 128GB",
    "brand": "Samsung",
    "category": "Smartphone",
    "subcategory": "Premium Tech",
    "price": 17990000.0,
    "currency": "VND",
    "rating": 4.3,
    "review_count": 1018,
    "seller": "Samsung Official Store",
    "product_url": "https://shop.sentinel.ai/p/galaxy_s24",
    "image_url": "https://assets.sentinel.ai/images/galaxy_s24.jpg",
    "source": "catalog_sync",
    "created_at": "2026-07-26T08:00:00Z",
    "updated_at": "2026-09-24T08:00:00Z"
  },
  {
    "product_id": "xiaomi_14_pro",
    "product_name": "Xiaomi 14 Pro 256GB",
    "brand": "Xiaomi",
    "category": "Smartphone",
    "subcategory": "Premium Tech",
    "price": 16990000.0,
    "currency": "VND",
    "rating": 4.8,
    "review_count": 1716,
    "seller": "Xiaomi Official Store",
    "product_url": "https://shop.sentinel.ai/p/xiaomi_14_pro",
    "image_url": "https://assets.sentinel.ai/images/xiaomi_14_pro.jpg",
    "source": "catalog_sync",
    "created_at": "2026-07-26T08:00:00Z",
    "updated_at": "2026-09-24T08:00:00Z"
  },
  {
    "product_id": "pixel_8_pro",
    "product_name": "Google Pixel 8 Pro 128GB",
    "brand": "Google",
    "category": "Smartphone",
    "subcategory": "Premium Tech",
    "price": 18500000.0,
    "currency": "VND",
    "rating": 4.4,
    "review_count": 3192,
    "seller": "Google Official Store",
    "product_url": "https://shop.sentinel.ai/p/pixel_8_pro",
    "image_url": "https://assets.sentinel.ai/images/pixel_8_pro.jpg",
    "source": "catalog_sync",
    "created_at": "2026-07-26T08:00:00Z",
    "updated_at": "2026-09-24T08:00:00Z"
  },
  {
    "product_id": "rog_phone_8",
    "product_name": "Asus ROG Phone 8 Pro 512GB",
    "brand": "Asus",
    "category": "Smartphone",
    "subcategory": "Premium Tech",
    "price": 24990000.0,
    "currency": "VND",
    "rating": 4.8,
    "review_count": 3597,
    "seller": "Asus Official Store",
    "product_url": "https://shop.sentinel.ai/p/rog_phone_8",
    "image_url": "https://assets.sentinel.ai/images/rog_phone_8.jpg",
    "source": "catalog_sync",
    "created_at": "2026-07-26T08:00:00Z",
    "updated_at": "2026-09-24T08:00:00Z"
  },
  {
    "product_id": "macbook_pro_m3",
    "product_name": "MacBook Pro 14 M3 512GB",
    "brand": "Apple",
    "category": "Laptop",
    "subcategory": "Premium Tech",
    "price": 39990000.0,
    "currency": "VND",
    "rating": 4.8,
    "review_count": 1559,
    "seller": "Apple Official Store",
    "product_url": "https://shop.sentinel.ai/p/macbook_pro_m3",
    "image_url": "https://assets.sentinel.ai/images/macbook_pro_m3.jpg",
    "source": "catalog_sync",
    "created_at": "2026-07-26T08:00:00Z",
    "updated_at": "2026-09-24T08:00:00Z"
  },
  {
    "product_id": "macbook_air_m3",
    "product_name": "MacBook Air 13 M3 256GB",
    "brand": "Apple",
    "category": "Laptop",
    "subcategory": "Premium Tech",
    "price": 27490000.0,
    "currency": "VND",
    "rating": 4.6,
    "review_count": 807,
    "seller": "Apple Official Store",
    "product_url": "https://shop.sentinel.ai/p/macbook_air_m3",
    "image_url": "https://assets.sentinel.ai/images/macbook_air_m3.jpg",
    "source": "catalog_sync",
    "created_at": "2026-07-26T08:00:00Z",
    "updated_at": "2026-09-24T08:00:00Z"
  },
  {
    "product_id": "dell_xps_15",
    "product_name": "Dell XPS 15 9530 Core i7",
    "brand": "Dell",
    "category": "Laptop",
    "subcategory": "Premium Tech",
    "price": 45990000.0,
    "currency": "VND",
    "rating": 4.3,
    "review_count": 1575,
    "seller": "Dell Official Store",
    "product_url": "https://shop.sentinel.ai/p/dell_xps_15",
    "image_url": "https://assets.sentinel.ai/images/dell_xps_15.jpg",
    "source": "catalog_sync",
    "created_at": "2026-07-26T08:00:00Z",
    "updated_at": "2026-09-24T08:00:00Z"
  },
  {
    "product_id": "thinkpad_x1_carbon",
    "product_name": "Lenovo ThinkPad X1 Carbon Gen 11",
    "brand": "Lenovo",
    "category": "Laptop",
    "subcategory": "Premium Tech",
    "price": 38990000.0,
    "currency": "VND",
    "rating": 4.6,
    "review_count": 1318,
    "seller": "Lenovo Official Store",
    "product_url": "https://shop.sentinel.ai/p/thinkpad_x1_carbon",
    "image_url": "https://assets.sentinel.ai/images/thinkpad_x1_carbon.jpg",
    "source": "catalog_sync",
    "created_at": "2026-07-26T08:00:00Z",
    "updated_at": "2026-09-24T08:00:00Z"
  },
  {
    "product_id": "ipad_pro_m4",
    "product_name": "iPad Pro 11 M4 OLED 256GB",
    "brand": "Apple",
    "category": "Tablet",
    "subcategory": "Premium Tech",
    "price": 28990000.0,
    "currency": "VND",
    "rating": 4.4,
    "review_count": 1389,
    "seller": "Apple Official Store",
    "product_url": "https://shop.sentinel.ai/p/ipad_pro_m4",
    "image_url": "https://assets.sentinel.ai/images/ipad_pro_m4.jpg",
    "source": "catalog_sync",
    "created_at": "2026-07-26T08:00:00Z",
    "updated_at": "2026-09-24T08:00:00Z"
  },
  {
    "product_id": "galaxy_tab_s9",
    "product_name": "Samsung Galaxy Tab S9 128GB",
    "brand": "Samsung",
    "category": "Tablet",
    "subcategory": "Premium Tech",
    "price": 16490000.0,
    "currency": "VND",
    "rating": 4.8,
    "review_count": 2208,
    "seller": "Samsung Official Store",
    "product_url": "https://shop.sentinel.ai/p/galaxy_tab_s9",
    "image_url": "https://assets.sentinel.ai/images/galaxy_tab_s9.jpg",
    "source": "catalog_sync",
    "created_at": "2026-07-26T08:00:00Z",
    "updated_at": "2026-09-24T08:00:00Z"
  },
  {
    "product_id": "sony_wh1000xm5",
    "product_name": "Sony WH-1000XM5 Wireless Headphones",
    "brand": "Sony",
    "category": "Accessories",
    "subcategory": "Premium Tech",
    "price": 7990000.0,
    "currency": "VND",
    "rating": 4.7,
    "review_count": 2860,
    "seller": "Sony Official Store",
    "product_url": "https://shop.sentinel.ai/p/sony_wh1000xm5",
    "image_url": "https://assets.sentinel.ai/images/sony_wh1000xm5.jpg",
    "source": "catalog_sync",
    "created_at": "2026-07-26T08:00:00Z",
    "updated_at": "2026-09-24T08:00:00Z"
  },
  {
    "product_id": "airpods_pro_2",
    "product_name": "Apple AirPods Pro 2 USB-C",
    "brand": "Apple",
    "category": "Accessories",
    "subcategory": "Premium Tech",
    "price": 5490000.0,
    "currency": "VND",
    "rating": 4.8,
    "review_count": 3838,
    "seller": "Apple Official Store",
    "product_url": "https://shop.sentinel.ai/p/airpods_pro_2",
    "image_url": "https://assets.sentinel.ai/images/airpods_pro_2.jpg",
    "source": "catalog_sync",
    "created_at": "2026-07-26T08:00:00Z",
    "updated_at": "2026-09-24T08:00:00Z"
  }
]